{
  "schemaVersion": "0.2.0",
  "pocId": "poc-fixture-model",
  "modelId": "fixture/model",
  "modelRevision": "0123456789abcdef0123456789abcdef01234567",
  "fixtureId": "text-generation/basic-v1",
  "generatedAt": "2026-09-17T00:00:00.000Z",
  "ios": { "runtime": "core-ai", "status": "blocked", "harnessPath": "pocs/ios-coreai/main.swift", "reason": "Fixture." },
  "android": { "runtime": "executorch", "status": "blocked", "harnessPath": "pocs/android-executorch/Main.kt", "reason": "Fixture." }
}
